### ISSUE TITLE
Test Floating IP on self-managed network

### ISSUE THREAD

**Issue by oomichi** [oomichi/try-kubernetes#78]
https://github.com/oomichi/try-kubernetes/issues/77 で作成できるようになった self-managed network 上のPort に対して Floating IP をつけて ssh ログインできるようになることを確認する。

**Comment by oomichi** [comment]
Pingが通らない状態
```
$ nova list
+--------------------------------------+-------+--------+------------+-------------+----------------------------+
| ID                                   | Name  | Status | Task State | Power State | Networks                   |
+--------------------------------------+-------+--------+------------+-------------+----------------------------+
| 50c3b52d-9078-42de-8ce5-dee3498d1789 | test1 | ACTIVE | -          | Running     | lb-mgmt-net=192.168.10.104 |
| 7738f6a0-84ad-42a6-a460-19ba8e296334 | test2 | ACTIVE | -          | Running     | lb-mgmt-net=192.168.10.102 |
| e06cf0cb-050d-42b5-abc0-9c7a7a9c357a | test3 | ACTIVE | -          | Running     | lb-mgmt-net=192.168.10.107 |
+--------------------------------------+-------+--------+------------+-------------+----------------------------+
$ ping 192.168.10.104
PING 192.168.10.104 (192.168.10.104) 56(84) bytes of data.
^C
--- 192.168.10.104 ping statistics ---
11 packets transmitted, 0 received, 100% packet loss, time 10080ms
```
self-managed network から外部へ繋がるための Router を作成、接続
```
$ openstack router create lb-mgmt-router
$ openstack router add subnet lb-mgmt-router lb-mgmt-subnet
$ openstack router set lb-mgmt-router --external-gateway provider
```

**Comment by oomichi** [comment]
しかし、引き続き Ping は通らない。
```
$ ping 192.168.1.108
PING 192.168.1.108 (192.168.1.108) 56(84) bytes of data.
From 192.168.1.1 icmp_seq=1 Destination Host Unreachable
From 192.168.1.1 icmp_seq=2 Destination Host Unreachable
From 192.168.1.1 icmp_seq=3 Destination Host Unreachable
```
tcpdump で何処まで通っているのかを確認する。

test1 は iaas-cpu03 に存在する。
```
$ nova show test1
+--------------------------------------+------------------------------------------------------------+
| Property                             | Value                                                      |
+--------------------------------------+------------------------------------------------------------+
| OS-DCF:diskConfig                    | MANUAL                                                     |
| OS-EXT-AZ:availability_zone          | nova                                                       |
| OS-EXT-SRV-ATTR:host                 | iaas-cpu03                                                 |
...
```
iaas-cpu03 上の vxlan-24 を tcpdump。
iaas-ctrl から Ping 実行時、パケットが届いていることを確認
```
$ sudo tcpdump -i vxlan-24
[sudo] password for ubuntu:
Sorry, try again.
[sudo] password for ubuntu:
tcpdump: verbose output suppressed, use -v or -vv for full protocol decode
listening on vxlan-24, link-type EN10MB (Ethernet), capture size 262144 bytes



14:29:43.513842 IP 192.168.10.104.39544 > 192.168.10.100.domain: 48522+ A? ntp.ubuntu.com. (32)
14:29:43.513981 IP 192.168.10.104.39544 > 192.168.10.100.domain: 31020+ AAAA? ntp.ubuntu.com. (32)
14:29:43.514830 IP 192.168.10.100.domain > 192.168.10.104.39544: 48522 Refused 0/0/0 (32)
14:29:43.514902 IP 192.168.10.100.domain > 192.168.10.104.39544: 31020 Refused 0/0/0 (32)
14:29:43.515404 IP 192.168.10.104.39544 > 192.168.10.100.domain: 48522+ A? ntp.ubuntu.com. (32)
```
